{
  "source_url": "http://somewhere.com/a",
  "sample_date": "2014-02-01",
  "start_date": "2014-01-01",
  "end_date": "2015-02-01",
  "confidence": "HIGH",
  "parent_name": "Widgets R US",
  "parent_jurisdiction": "us_de",
  "direct": true,
  "percentage_controlled": "56",
  "subsidiary_name": "Little Widgets",
  "subsidiary_jurisdiction": "us_de"
}